{
  "task_id": "TSK-0001",
  "verdict": "ACCEPT",
  "rationale": "Task output matches schema and required quality gates are satisfied.",
  "required_changes": [],
  "next_task_suggestion": "TSK-0002",
  "artifact_checks": [
    "Verified report_json/report_md paths exist and are readable.",
    "Verified worker_log and worker_stderr paths exist and match executed command evidence."
  ],
  "full_techspec_complete": true,
  "approval_required": false,
  "created_at": "2026-02-24T12:35:00Z"
}
